{
  "knowledge_id": "rewrite:disclose-localization",
  "corpus_type": "rewrite",
  "rewrite_id": "disclose-localization",
  "legacy_template_id": "disclose-localization",
  "rewrite_purpose": "Guide reviewers to clarify market-appropriate localization of product imagery, packaging, and manuals in advertising assets.",
  "rewrite_status": "production",
  "rewrite_version": "1.0.0",
  "rewrite_strategy_type": "disclose",
  "summary": "Clarify or replace assets localized for a market other than the target country with English or local-market appropriate materials.",
  "rewrite_guidance": "TRIGGER: Foreign-language packaging, manuals, or product imagery mismatched to target market. ACTION: Use English or local-market assets and clarify localization in copy. CHECK: Product images, subtitles, and manual references. ESCALATE IF: Misleading market representation persists after disclosure.",
  "review_guidance": "ESCALATE IF: Localization mismatch could mislead consumers about product origin or warranty scope.",
  "measurable_criteria": {
    "must_remove_terms": ["chinese product image", "chinese manual"],
    "must_include_concepts": ["local", "english"],
    "scoring_notes": "must_remove_terms on ad text; must_include_concepts on rewrite guidance text."
  },
  "benchmark_refs": ["AF-001", "AF-008"],
  "case_refs": [],
  "applicability": {
    "countries": ["SG", "MY", "TH"],
    "modalities": ["text", "image"],
    "claim_types": ["disclosure-localization"]
  },
  "linkage": {
    "regulations": ["regulation:sg-scap-disclosure"],
    "rules": ["demo-apac-sa-localization"]
  },
  "rewrite_linkage_scope": "independent",
  "rewrite_independence_rationale": "Standalone localization disclosure rewrite guidance; not bound to a Skill Corpus module entry.",
  "expected_evidence_type": "none",
  "evidence_requirement": "none",
  "confidence_level": "high",
  "owner": "compliance-apac@aairp",
  "owner_type": "compliance",
  "last_reviewed": "2026-07-01T00:00:00.000Z",
  "review_status": "legal_reviewed",
  "tags": ["confidence:high", "evidence:none", "disclosure", "localization"]
}
