{
  "knowledge_id": "rewrite:disclose-ai",
  "corpus_type": "rewrite",
  "rewrite_id": "disclose-ai",
  "legacy_template_id": "disclose-ai",
  "rewrite_purpose": "Guide reviewers to add AI-generated or illustration disclaimers for synthetic or rendered advertising imagery.",
  "rewrite_status": "production",
  "rewrite_version": "1.0.0",
  "rewrite_strategy_type": "disclose",
  "summary": "Add clear AI-rendered or illustration-only disclaimer when synthetic imagery could be mistaken for real photography.",
  "rewrite_guidance": "TRIGGER: AI-generated models, synthetic imagery, or illustration-style product renders. ACTION: Add visible AI/synthetic media or illustration disclaimer. CHECK: Visual realism, likeness rights, and disclosure placement. ESCALATE IF: Synthetic human likeness without consent.",
  "review_guidance": "ESCALATE IF: Disclosure is buried or illegible at typical mobile ad resolution.",
  "measurable_criteria": {
    "must_remove_terms": [],
    "must_include_concepts": ["illustration", "purposes only"],
    "scoring_notes": "must_include_concepts checked on playbook rewrite guidance text."
  },
  "benchmark_refs": ["AF-007", "PC-014"],
  "case_refs": [],
  "applicability": {
    "countries": ["SG", "MY", "TH"],
    "modalities": ["image", "video"],
    "claim_types": ["disclosure-ai"]
  },
  "linkage": {
    "regulations": ["regulation:sg-imda-ai-disclosure", "regulation:sg-asas-influencer-disclosure"],
    "rules": ["demo-apac-sa-ai-image-disclaimer"]
  },
  "rewrite_linkage_scope": "independent",
  "rewrite_independence_rationale": "Standalone AI/illustration disclosure rewrite guidance; independent of claim-class skill entries.",
  "expected_evidence_type": "none",
  "evidence_requirement": "none",
  "confidence_level": "high",
  "owner": "compliance-apac@aairp",
  "owner_type": "compliance",
  "last_reviewed": "2026-07-01T00:00:00.000Z",
  "review_status": "legal_reviewed",
  "tags": ["confidence:high", "evidence:none", "disclosure", "ai"]
}
